{
  "openyacht": "1.0",
  "protocol_versions": ["1.0"],
  "node": {
    "uuid": "018f3c2e-4b6a-7d8e-9f01-23456789abcd",
    "name": "Example Yacht Brokerage",
    "software": "openyacht-reference/1.0",
    "website": "https://example-brokerage.com"
  },
  "keys": [
    {
      "key_id": "25f0c5c537a07c58",
      "algorithm": "ed25519",
      "public_key": "QKcwbi+S0spqvUIba9P45r2SDvKqbXmjCb6zsTn51Ac=",
      "created_at": "2026-08-20T10:30:00Z"
    }
  ],
  "endpoints": {
    "listings": "/openyacht/v1/listings",
    "partners": "/openyacht/v1/partners",
    "subscriptions": "/openyacht/v1/subscriptions",
    "health": "/openyacht/v1/health",
    "capabilities": "/openyacht/v1/capabilities"
  },
  "generated_at": "2026-08-20T10:30:00Z"
}
